Politics,0.0,2.0624170444015926,3.4317718940936865,1.0059842020927359,"Thanks Delhi - For giving India some hopeI, from Mumbai, really want to congratulate Delhi people for giving hope to rest of India. Giving hope that there still are some people who want India to develop instead of fighting in the name of Religion & Pakistan. I really pray that BJP comes to senses and sees something beyond Pakistan & Muslims.

****EDIT****
I understand and agree with what most people say regarding BJP still winning national elections if held today. But imagine a scenario where both National and State governments controlled by 1 party. That will be scary."
Sports,0.0,2.7345675754963024,0.0,0.9528287404338296,Indians Right Now.
Non-Political,0.0,2.4663101886468444,10.29531568228106,1.0090752147380138,Tumbbad fan poster by me
Politics,0.0,5.665806999216506,3.4317718940936865,1.0033297041646974,story of the German student forced to leave after CAA protests
AskIndia,0.0,0.004521191913193115,0.0,1.0095569984821915,Best way to send small payments from India to Turkey?Since PayPal doesn't work in Turkey Im look for other website that I can use to send money (mostly below $80) to turkey.
Coronavirus,0.0,3.401443382692287,0.0,1.0095873934820667,Police Officer feeding an amputee Monkey. ( Originally posted in r/HumanBeingBros )
AskIndia,0.0,1.5334375905579982,3.4317718940936865,1.0006030568364612,Who else miss the old Cartoon Network Shows?
CAA-NRC-NPR,0.0,0.08967030627833011,0.0,1.0096630899515873,Sharjeel Imam charge-sheeted for giving seditious speech & abetting riots in Jamia on 15th December 2019: Delhi Police
Coronavirus,0.0,0.031648343392351806,0.0,1.0095001594952748,IAS edge proves a winner as chief secretaries overshadow political bosses in virus battle
Non-Political,0.0,2.8649286089933708,0.0,0.9903265303429731,Just another street in Hyderabad
Non-Political,0.0,1.6110513850678134,0.0,0.9745489020013334,I took this image while travelling in the remote villages of Telangana. A man is getting ready to perform in a play while his daughter observes him with all wonder.
Coronavirus,0.0,1.406844216988591,6.863543788187373,1.0096779277191537,Migrant Workers
Non-Political,0.0,2.04433227674882,0.0,0.9948325990935564,Spotted in Delhi
Politics,0.0,1.617079640952071,3.4317718940936865,1.0058219446635654,Delhi Elections 2020 by Sanitary Panels
Coronavirus,0.0,0.050486643030656454,0.0,1.009624595089143,Bengaluru Students developed a hyperlocal information and fact gathering site to help their community against COVID-19
Non-Political,0.0,0.019591831623836833,0.0,1.0096899245233781,"Swiggy has disabled Swiggy Super, pathetic, trying to profit in these times!The reasons they cite is typical HR bullshit- ""don't want to harm the experience of the customers"". Had no issues with swiggy till I found today that I can't extend my subscription. Its completely in their hand, true, but a really pathetic move.

Their overhead costs haven't increased (remember, their job is to only deliver). Compare it with Zomato, who actually extended everyone's Gold by a month, this really leaves a bad taste."
Coronavirus,0.0,0.013563575739579345,0.0,1.009601457713712,COVID-19: India allows rural poor to work in virus lockdown
Policy/Economy,0.0,0.009795915811918417,0.0,1.0096690034301423,"Sino-Indian Relationship post COVID-19 (DISCUSSION).Note: This it a self post and NOT VERIFIED NEWS.
I'm just trying to find others intrested in geopolitics and international relations and have (what could be) a wonderful discussion.

Post the pandemic, China is gonna be facing a shit storm and India is definitely a country they want on their side.

China is being ""kind and generous"" to India with donations of protective gear and has also promised to help produce ventilators, etc. 
India on the other hand has not blamed China for the outbreak dispite the followers of the populist govt. criticizing china and (what appears to be state backing) media shit talking about china too.

Sino-Indian relationship has always been mature and dignified, unlike Indo-Pak relations. And both India and China are wonderful at playing their cards on the geopolitical table.

Given the situation, and the slightly underwhelming govt and it's international relations, what do you think India will get out of this situation ?

Will the govt. be content with masks and ventilators? 
Will they push as far as permanant membership in P5 (possibly ruining relations with japan) (unlikely, I know.) ?
Is it likely India will criticize and blame china for lack of transparency and take a moral high (and diplomatic relations low) road ?  
How far do you think India will go ?

Keep in mind that the last time China fucked up (1990s after Tiananmen square) India pushed for Peace and Tranquility Agreement. 

Some interesting articles about the same.

https://www.defencenews.in/article/Why-China-has-changed-tune-on-ties-with-India-830065

https://thediplomat.com/2020/04/how-is-covid-19-reshaping-china-india-relations/"
Non-Political,0.0,0.0007535319855321859,0.0,1.0095786282259338,Anubhav Sinha's ScoopWhoop Interview
Coronavirus,0.0,0.1326216294536647,0.0,1.0096060079624323,‘I am so afraid’: India’s poor face world’s largest lockdown
Politics,0.0,2.30957553565615,0.0,1.002690401534998,From Deccan Herald - 12.12.19
Non-Political,0.0,0.053500770972785196,0.0,1.0095487554900318,Actor Ranjit Chowdhry dead at 65
Coronavirus,0.0,1.730862970767431,3.4317718940936865,1.0087275122498525,Today's March 32nd | Line of no control | TOI
Policy/Economy,0.0,1.6313967486771823,0.0,1.0023014618214352,No Onion at Subway
Politics,0.0,1.1845522812565963,3.4317718940936865,1.004288432600625,Anurag Kashyap demands PM Narendra Modi’s father’s birth certificate
Politics,0.0,1.2305177323740595,0.0,0.9645297047001927,"People, fear not. New security features added to Aadhaar Database that'll prevent unauthorized access. Pic for illustration."
AskIndia,0.0,0.06781787869789672,0.0,1.0095748795029214,"Solve my family dispute!In my country, the quarantine began nearly around 15 march and I've been home since then along with my brother, mother, father and grandmother. My father has been abusing all of us mentally since the quarantine began and Today he tried to beat the three of us (me, brother and mother) with a stick but we were successfully able to defend but got minor injuries and then the community people arrived. And somehow the dispute was solved ( as we all thought ) but since then he's really angry and I'm truly afraid of my life. He threatened that he'll kill us and all of my mother's family. Please guide me on how to get help and solve this! I'm unable to understand who to contact and how to go forward. My mother has agreed for a divorce but we'll apply for that once this gets over.
Please don't joke around as I'm genuinely afraid and I'm literally crying and shaking all the time.

Follow up because a lot of people are talking about calling the police: We called the police but the people told us to not file anything and we didn't because they said my dad's really sorry and all that shit. But when we came back to the house he showed off that he was to everyone so we calmed down, but now when everyone is gone, he's back to his true self. I'm really looking forward to filing that report if he tries anything, but I'm afraid that he'll kill us the next time."
AskIndia,0.0,0.012056511768514975,0.0,1.0094984381233978,"Can I get rabies from a cat bite?Okay so idk where else to ask this and I've been panicking like crazy for the past hour. I took in two stray kittens, they mostly stay indoors but sometimes go outside. A few months ago I was feeding them boiled chicken and one of their teeth touched my finger, I wasn't sure if I bled but I went to the hospital, told them what happened. They gave me 4 shots on days 0,3,7 and 28 and asked me to get a booster a year later. Today while I was about to go out, one of them bit me on the leg through pants. I was wearing thick jeans at the time but I did feel her teeth, I went outside but I had a bit of realization 10 minutes in and decided to check my leg. I couldn't find a wound, I dont believe she penetrated through the clothes and it didnt seem like that strong of a bite either. But I still washed it with soap and water about 20 minutes after I got the bite and then I went to the hospital. The doctor there didn't even know what days they were supposed to administer the doses and kept confusing me but then he started writing the 4 dose vaccine again and I told him I already took it 2 months ago. Then he said I don't need anything and simply recommended me a tetanus shot. I took the tetanus shot but I'm growing increasingly paranoid. It's been almost 2 hours since that bite. I've checked on Google in some cases the wound is so tiny you need a magnifying glass to see it. This guy didn't even ask me where I was bitten, if I was bitten, if I bled, as soon as he heard cat bite he'd started writing. I don't know if I should trust him, I'm kind of a paranoid person. I live in a small town so there's no private hospitals here, there's private clinics but they don't open till 5 pm. I don't know, what do I do?"
Non-Political,0.0,1.5266558026882087,0.0,0.9840980795383866,Help Simran
AskIndia,0.0,0.008288851840854044,0.0,1.009537583748381,"Found this girl on Indian matrimony siteHey all,

I really liked this girl on a matrimony site. As  usual i sent a message in the website and got no reply, then i sent a whatsapp msg (very polite)  to the number provided but it turned out to be her father's number (DP) . He has seen my messages but still no reply not even acknowledging it. It's been 4 days since my last message.

What should i supposed to infer from this? . Should i call the phone number tomorrow to figure this out?. Someone with matrimony experience help me out. I dont want to be rude."
Photography,0.0,1.3066244629128103,0.0,0.980437224735697,This mildly interesting imprint left behind after years of use. [Delhi Metro]
Politics,0.0,1.276483183491523,0.0,1.0090001734839529,"COVID-19: Man posts ‘no ventilators in Ludhiana’ on Facebook, booked for sedition"
Non-Political,0.0,0.005274723898725301,0.0,1.0095600786309826,Anyone who is vegan or interested in veganism? 🙈I've recently become vegan and have been trying to be more active and reach out to people and show them the ugly realities of meat and dairy industry. I'd be happy to talk to anyone who might even have the slightest interest in it or cares for animals even a bit
Politics,0.0,2.448978952979604,3.4317718940936865,1.0067571909407813,Hotstar nukes PM Modi episode of last week tonight with john oliver.
Non-Political,0.0,0.0007535319855321859,0.0,1.00968234183573,Crime-lovers boxset only $2.99 on Amazon. Link posted below.
AskIndia,0.0,0.004521191913193115,0.0,1.0094666684433204,"Waiting to go to IndiaHi All , anyone struck like me and waiting to go to india . I had my flight scheduled on March 18 , but I don’t want to quarantined so , I cancelled my flight . I was hoping everything would be fine till mid april . Now we have more than 10k cases . I read news like people are re affected  by this virus . It’s staying on cardboard for more than 72 hours .  Cases are growing . With all this issues and no vaccines in near future .. When do you guys think this settles ."
Non-Political,0.0,7.047031128697002,3.4317718940936865,0.9989446276280964,"Spend nearly 500 rs bucks to watch JOKER and in return all i got was 30 mins of advertiment before the movies,20 mins adver. in interval, giant subtitles, and stupid tobacco discalimer which stuck through 70% of the time in the screen,which made crucials scenes so distracting and out of focus."
Non-Political,0.0,0.07158553862555765,0.0,1.0095440137657254,"Foreign dream will have to wait as Covid-19 layoffs in US cast shadow on IIT, IIM placements"
Science/Technology,0.0,3.1444889756258116,10.29531568228106,0.9947832829979256,I saw the Chandrayaan 2 launch in person
AskIndia,0.0,0.0030141279421287436,0.0,1.0095315595829424,Scholarship at US universitiesIs it possible to get scholarship at US universities for course based or professional master’s courses? I want to pursue MS in Computer Science (course based/professional) ?
AskIndia,0.0,0.004521191913193115,0.0,1.0095678610639263,"How to meet with the Police commissioners?Hello all!

I am designing an app that will drastically improve the quality of life (QOL) of users. I cannot share any specifics of the app right now, like what the app will do etc. 

I plan to make the app completely free for the police forces, in order to contribute to the community and because the app will also be immensely helpful to improve the QOL of the police force as well. They do so much for our safety and well-being, this is the least we can do.

My question is how can I meet with the Police commissioners or any other senior person who has the authority to take the decision, in order to give my presentation for the same.

Thanks in advance.

Edit: changed order of a word for correct grammar."
Coronavirus,0.0,0.02562008750809432,0.0,1.009580263083925,"Odisha Government sanctions an additional fund of Rs 80,18,000 from Chief Ministers Relief Fund to various Urban local bodies to feed stray animals during the extended lockdown period. State Govt had earlier sanctioned Rs 54 lakh for the purpose."
Coronavirus,0.0,0.04521191913193115,0.0,1.0096736217449347,"Telangana: Woman dies in queue waiting for Rs 1,500 dole | Hyderabad News - Times of India"
AskIndia,0.0,0.010549447797450602,0.0,1.0095643756993604,"What are the healthy food items at stores which I can eat without cooking?(Serious Post. Need only genuine answers.)

Atta Bread and Peanut Butter are best examples. No stove or cooker required.

  


Any more such examples?"
Politics,0.0,1.9109571153096234,3.4317718940936865,1.005926170995362,Which is that strange weapon which can transform India?
Coronavirus,0.0,0.051993707001720825,0.0,1.009607366103215,94 health department officials in Madhya Pradesh now infected with virus
Politics,0.0,0.06329668678470361,0.0,1.0096059119065737,U.S. provides nearly $5.9 million in health assistance to India on COVID-19
Policy/Economy,0.0,0.0587754948715105,0.0,1.0096238400010356,Govt waives off four months rent for IT units operating out of software tech parks
Non-Political,0.0,1.5394658464422557,3.4317718940936865,0.988780855445483,"The Mizoram kid, Derek C Lalchhanhima, whose innocent act of taking a chick to hospital went viral yesterday was appreciated at his School St. Pio, Sairang today."
Politics,0.0,0.9667815374377945,3.4317718940936865,1.009459095297645,Ambedkar Jayanti 2020
AskIndia,0.0,0.004521191913193115,0.0,1.0096714773456006,Indian Navy reports first coronavirus outbreak
Science/Technology,0.0,0.1281004375404716,0.0,1.0096125104987694,Seven IITs drop out of participation in Times Higher Education Rankings 2020
Politics,0.0,1.6931863714908217,3.4317718940936865,1.0048318555801243,The famous duo in new movie
Photography,0.0,1.52364167474608,3.4317718940936865,0.9961335319329686,"[OC] A view from our campsite in Dallapalli, Andhra Pradesh. 4608x2304, Shot on OnePlus 5T. F1.7 ISO100."
Non-Political,0.0,0.004521191913193115,0.0,1.0095983336718461,I got an email from a Chinese Manufacturer who manufactured phone cases and is now offering to sell masks.
Non-Political,0.0,1.0602195036437856,0.0,0.9705227200507527,Morning Scenes in my village!
Coronavirus,0.0,0.07158553862555765,0.0,1.009676609018525,Extend lockdown till end of Ramadan: Muslim activist to PM
AskIndia,0.0,0.010549447797450602,0.0,1.0096883112938584,"What is the biggest jugaad you have ever pulled off?(Roughly translated, *Jugaad* is a non-conventional, frugal innovation, often termed as ""hack"". It could also refer to an innovative fix or a simple work-around, a solution that bends the rules, or a resource that can be used in such a way.)"
Politics,0.0,2.1437984988390686,0.0,0.9565216359086215,"Dera Sacha Sauda chief Gurmeet Ram Rahim found guilty of rape, taken into judicial custody"
Politics,0.0,2.2349758690884634,3.4317718940936865,1.0029281467825524,"This girl with a ""Donate a book to the needy"" placard"
Non-Political,0.0,1.2131864967068193,0.0,0.9900561470958249,GTA 5 girl wearing a beautiful saree
AskIndia,0.0,0.004521191913193115,0.0,1.0095168204157607,"Airlines Cancellation Policy?Hi Guys, 

Since the lockdown has extended and it’s clear and obvious that we have no visibility on when the international travel would start.

Is there a government mandated guidelines for the cancellation and refunds? If so, where can we find these?

The official airline policies seems to be terrible, specially Air India."
Politics,0.0,1.4776762236286165,0.0,0.9700833039376774,Welcome home Dr. Kafeel Khan
Coronavirus,0.0,0.0015070639710643718,0.0,1.0094761321718557,"Things we won't take for granted anymore!When this is all over ,
may we never again ,
take for granted :

those warm handshakes & friendly hugs ,
that laundry guy who always appears to be on drugs ,

that neighbourhood housefull theatre ,
the guy who works as your barber,

those annoying relatives who keep visiting your place with no reason ,
that enthu friend who wants to go on a trip no matter what season ,

that food hawker who developed our taste bud ,
that sky blue jeans which was always covered in mud,

those full shelves in a grocery store ,
that cleaning guy who mops the floor,

that stadium with continuous roaring ,
that train you got to catch every morning ,

those torpid lazy monday blue ,
that beggar you used to daily pass through,

that uber driver who helped to commute,
that friend you used as a substitute,

those random long drives that set you free,
that moment when they credit your hard earned rupee,

that routine checkup at the clinic you depend,
the favourite hangout place you always recommend.

        One day life will resume and we shall be grateful for life in ways we never felt possible before."
Non-Political,0.0,0.13714282136685782,0.0,1.0096750937532584,"India Will Become Less Religious If We Had Social Security and Free HealthcareThe most common human anxieties are around the basics: food, shelter, health. In India, I notice that a lot of people depend on religion to ease their anxieties around these issues. For a lot of people, there is no certainty around income, there is no accessibility to health care. This creates massive anxieties. People turn to religion as a way to cope with these anxieties.

You can also contrast Western Europe, which is not very religious, with the USA, which, in comparison, is highly religious. Most countries in Western Europe have a reasonable social security program and healthcare for all. The US, on the other hand, has highly conditional social security and very low healthcare access and affordability. I am not arguing that the US also has great technology in healthcare but that accessibility is low because of issues and expenses of health insurance. Similarly, social security is available in the US but is difficult, and often humiliating, to access. This creates huge anxieties around food, shelter and healthcare. Interestingly, America is a much more religious society than Western Europe. Is this a coincidence?

I am also not arguing that there are no outliers. That is, there are a lot of rich people who have access to healthcare who are very religious. Similarly, there might be poor atheists. These outliers can be explained by the fact that everyone's personal journey is different and various types of life events might result in different views on religion.

What do y'all think? Is this a reasonable view?

Edit: And if Modi realises this, he will ensure that we will never have any form of social security or healthcare."
Non-Political,0.0,1.1423544900667937,0.0,0.9677202261259586,Hah whats ur opinion
Non-Political,0.0,1.0760436753399614,0.0,0.9695312760071866,MRW my parents are grilling my brother about his gf
Coronavirus,0.0,0.21475661587667297,0.0,1.0096161472626355,"""1 Metre Social Distance? My Home Is 2 Metres Long"": Mumbai Slums Problem"
Coronavirus,0.0,1.6856510516354997,0.0,1.0084989902731212,Healthcare Experts in an AMA on low count of COVID-19 cases in India
Non-Political,0.0,1.6969540314184826,0.0,1.0094356500345614,"Today on the first day of Bengali calendar, wishing all of you a very hearty Subho Noboborsho!!!"
Politics,0.0,2.5356351313158054,3.4317718940936865,1.0030823310666772,Most powerful image of the day (@ranaayyub)
AskIndia,0.0,0.053500770972785196,0.0,1.0096838965411505,"What is the equivalent of Alcoholics Anonymous in Bangalore? Friend in bad shapeI have a friend who is a gem of a guy.. when he is sober. A full blown alcoholic, who is in bad withdrawal now because he can’t get booze. He is hitting himself, breaking things at home. He is roommates with another friend of mine who can’t take his shit anymore and has moved out. I am worried about this guy as I haven’t heard from him all day. He usually always responds to my calls or what’s app. 

I am afraid for him and I want to know if I can take him to some de addiction thing. Please advice."
Coronavirus,0.0,0.015070639710643718,0.0,1.0096752063485364,Coronavirus: Shaheen Bagh becomes Covid-19 hotspot as Delhi expands list of containment zones to 60
Non-Political,0.0,1.7172993950278517,0.0,0.9894527591791485,Winter is coming
Non-Political,0.0,0.03089481140681962,0.0,1.0096864862325443,"Sick of companies asking for charityI feel disgusted by companies like Uber Ola asking for charity. I mean sympathise with the sufferers and I try to do my bit for people around me. But these same companies have fucked over their drivers on multiple occasions , Uber even stooping to the point of denying drivers are even their employees. It is so hypocritical when they had the time they didn’t care for them , and now sending me charity requests with a such guilt ridden ads. Not saying anyone who does donate should not to these companies though just pointing out their double faced character."
Photography,0.0,0.0798743904664117,0.0,1.0095574965731668,"Today, people of Adipur (Gujarat) celebrate Charlie Chaplin's birthday by dressing up like him and broadcasting his movies. Adipur has the only Charlie Chaplin club in India (photos clicked last year) [OC] [1200x900] [Nikon D3300]"
Non-Political,0.0,3.015635006099808,0.0,1.0096301466088664,Rural India is wild. Literally.
AskIndia,0.0,0.005274723898725301,0.0,1.0095279361778382,"Help me find a store in MumbaiI need to buy filaments(PLA, ABS) for 3d printing in Mumbai. Direct me to a store that will deliver in this phase 2 lockdown."
Non-Political,0.0,1.4686338398022303,0.0,0.9878278312008425,Lenskart is an asshole. It won't let you unsubscribe from it's shitty emails by disabling the unsubscribe button
Coronavirus,0.0,0.004521191913193115,0.0,1.0096820765688885,"On Camera, Scores Violate Lockdown In Karnataka For Free Food"
Politics,0.0,0.01657770368170809,0.0,1.0096922241388016,Trump-Backed Drug to Be Tested on Thousands in Mumbai Slums
Sports,0.0,0.0030141279421287436,0.0,1.0095955346931842,"Equestrian Clubs in PuneHey all, I'm 22 and interested in learning equestrian sport (horse riding) after this Corona-situation calms down. I currently reside in Pune.

I already googled for some recommendations but asking here if anyone got experince/opinions regarding any clubs?!

Does the famous Royal Western India Turf Club Ltd have any training courses for adults?

Any suggestions on clubs/training schools?"
Politics,0.0,0.02562008750809432,0.0,1.0096061154686582,"RSS in control of Lockdown?Incident 1: 
 https://twitter.com/FriedrichPieter/status/1250948398515011584?s=19

First #RSS runs checkpoints in Hyderabad to enforce #Modi’s #lockdown. Now police in Agra line up obediently to be “honored” by RSS. Notice police are observing #socialdistancing but uniformed members of Nazi-inspired paramilitary are not. 

RSS is in control of lockdown. 
(original: https://twitter.com/friendsofrss/status/1250854612036247553?s=19)


Incident 2 :

Lathi-wielding RSS activists ‘checking’ ID of commuters sparks outrage

https://www.thehindu.com/news/cities/Hyderabad/lathi-wielding-rss-activists-checking-id-of-commuters-sparks-outrage/article31319329.ece"
AskIndia,0.0,0.015824171696175903,0.0,1.0095743960429706,"Migrating from the USDo you think it's weird/crazy to migrate to India if you're an American doctor?

What kind of neighbourhood could you live in? Could you live in the most upper class neighbourhood there? Would there be no pollution there?"
AskIndia,0.0,0.004521191913193115,0.0,1.0095581753254925,"Can anybody explain Art of Living / Sri Sri scam?As the title suggest, I want to know how AoL works.. How many different stages it consist to reach on the top means to be in inner circle with sri sri?"
Science/Technology,0.0,0.008288851840854044,0.0,1.0096116466321734,CCMB to develop inactivated virus vaccine for COVID-19
Science/Technology,0.0,2.1460590947956653,0.0,0.9948844215473526,"India supplied over two thirds of AIDS medication globally over the last two decades, bringing the treatment cost down from $414 per person per year to $74 per person per year which also supported the number of infected people getting treatment increasing over five fold during the last decade."
Non-Political,0.0,1.929795414947928,0.0,0.9714101597724208,Meanwhile in Gurugram
