flare,over_18,score,awards,creation_time,corpous
Non-Political,0.0,2.756420003076736,6.863543788187373,0.9908083694305925,Here to share my ballpoint pen drawing with my fellow Indians.
Politics,0.0,1.0752901433544293,0.0,1.0074627581180418,John Oliver slams Arnab Goswami and Hotstar
Coronavirus,0.0,3.2040180024828544,0.0,1.0084453802897702,A deserted East Express Highway in Mumbai
Politics,0.0,1.1770169614012742,0.0,1.007097226135803,Lesson for Delhi Police as Kolkata Police arrest three BJP workers for chanting ‘Goli Maaron Saalon Ko’ slogan in Amit Shah’s rally
Non-Political,0.0,1.8747875800040785,0.0,0.9147642190503783,Former President APJ Abdul Kalam passes away
Photography,0.0,2.980219002779795,0.0,0.9925692565251445,Inside Mysore Palace. [1080*1168] [OC] [Redmi Y2]
Science/Technology,0.0,3.219088642193498,0.0,0.9932348975440538,India's Bharti Research Centre in Antarctica.
Politics,0.0,2.720250467771191,3.4317718940936865,1.002953672195687,Howdy Modi !
Non-Political,0.0,4.358429004318163,0.0,0.9606910460502597,Memes work a bit differently when in Delhi!
Politics,0.0,2.574065262577947,3.4317718940936865,1.003225428214643,Deccan Herald 23/12/2019
Politics,0.0,0.011302979782982787,0.0,1.009650520629,Why Dr Kafeel Khan Is Not A Threat To National Security
Science/Technology,0.0,1.2380530522293813,0.0,0.9913528235792763,India investing more money in Solar Power than Coal for first time
AskIndia,0.0,0.0007535319855321859,0.0,1.0097064563091664,"Best non-political stand up comedian?Any thing related to politics gives me anxiety. So recommend me someone who doesn't include political jokes. 

Language can be English or Hindi"
AskIndia,0.0,0.010549447797450602,0.0,1.0094987262909736,"A Question to all Legit Suppliers and Manufacturers from IndiaHi all, I've been looking for direct suppliers and manufacturers for N95 masks from India particularly 3M masks. I heard that they were cheap if I source from this country and I've seen some very promising suppliers and manufacturers from India's B2B marketplaces with good prices. To cut the story short, I've got over 50 suppliers blowing my phone and email but my problem is 90% of them do not offer safe payment methods such as PayPal Goods and Services or Escrow (kind of like Alibaba's Trade Assurance).

All of them also seem to have the same method, send photos of the masks (some are really just recycled photos taken from elsewhere) and they do not even offer sample/trial orders (orders with very less quantity to check the item and verify authenticity). Some do, but minimum order is like 500-1000pcs which is definitely not a trial order. Somehow, I got a feeling that all these guys are part of one big elaborate scam. Asking to wire money through T/T, WU, MG etc. and PayPal Family & Friends. Some have websites but they are really very sketchy and badly designed.

We cannot buy from China either as their masks cost more than $5 dollars a piece even with a MOQ of 1000pcs. But we all know that 3M masks do not even reach a retail price of $2. Another reason why we can't buy from China is because the moment you sell more than the SRP, our government will arrest you and your goods get confiscated and donated. A close friend of mine owns a bunch of retail stores hence, why we are looking for extremely cheap 3M masks. Plus, we have contacts with a lot of private buyers and companies who want to buy masks at very high quantities.

So to sum it all up, there are no n95 masks here because no one wants to sell because the government won't allow us to sell it over the SRP (anti price-gouging), and we can't just rely on donations either.

So a question to all you legit suppliers and manufacturers out there, am I just asking to get screwed? What are your suggestions? How do you handle transactions from foreign buyers?"
Politics,0.0,2.0254939771105156,3.4317718940936865,1.0049784838941247,Maslow’s hierarchy of needs
Non-Political,0.0,1.4791832875996809,0.0,0.984689065435064,The real Punjabi deal
Politics,0.0,1.2418207121570424,3.4317718940936865,0.9889017872269713,Found Indian Niel DeGrasse Tyson
Non-Political,0.0,2.2688848084374116,3.4317718940936865,0.9990521860167638,I am a Muslim and I wish all my Hindu brothers and sisters a happy Dusshera!
Business/Finance,0.0,2.0036415495300823,3.4317718940936865,0.981685498608372,Creativity Level - Blue
Non-Political,0.0,1.0798113352676224,3.4317718940936865,0.9842741314794403,"Puia, the part-time watchman, full time artist is working on his first Mural and being paid for it. Chickpete metro station, Bengaluru. Show some love and support, reddit :)"
Non-Political,0.0,0.0,0.0,1.0097062762839482,"Amid Lockdown, Bumper Harvest In Telangana, FCI Sees Record Food Grain Arrivals"
Politics,0.0,2.046592872705417,0.0,1.0043242264486603,A poster at Shaheen Bagh
Politics,0.0,1.204144112880433,0.0,1.0042590834009588,Preach!🙌
Business/Finance,0.0,1.7210670549555125,0.0,0.9891245191346613,"Zomato delivery executives at Bawarchi, Hyderabad."
Politics,0.0,1.1099526146889098,6.863543788187373,1.003965746620387,"If you are in Delhi, go to JNU, call the police NOW!!Goons are attacking professors and students and destroying property. Armed with lathis rods and other reports of acid attacks"
Non-Political,0.0,1.8280685969010828,0.0,0.996809550801399,This genuinely makes me sad. Imagine a world without Wikipedia. Please help if you can.
Non-Political,0.0,4.06455152996061,3.4317718940936865,1.0043823815916795,From Swiggy’s Office in Kochi.
Non-Political,0.0,2.2560747646833645,3.4317718940936865,0.9967969350412114,When Google gives up
Science/Technology,0.0,1.2501095639978963,6.863543788187373,0.9841395953893914,"[R] Please don't get Jio Gigafiber, and I have several reasons to say so. I am cancelling my connections and I hope what I say in this post are compelling enough for you to support me.I am copying and pasting from a [comment I made in another thread](https://np.reddit.com/r/india/comments/adu4hg/indias_massive_jio_carrier_is_blocking_vpn_sites/edkyke4/), after someone suggested that I should make a thread about this.

Jio is using

1. Deep packet inspection
2. Carrier-grade NAT
3. Poorly configured stateful IPv6
4. Almost completely locked down router with some non-sequitor options
5. Clueless customer service, who just say ""we can't talk about X or Y or Z"" and who often do not even understand the question. If you ask about IPv6 settings, they'll say they can't help you, and then proceed to misinterpret it as a request for a static IP address. 

The first two are reasons enough to not use this shitty ISP.

To explain in more detail:

1. Every bit of data transmitted on the internet is transmitted as a packet. Think of this packet as a [matryoshka doll](https://en.wikipedia.org/wiki/Matryoshka_doll). What Jio does is open these dolls to see what the innermost dolls look like. That obliterates your privacy. Jio is using software that is good enough to deny you service even if you use strong encryption. I believe that heuristic analysis and the use of known signatures is a part of the firewall.
2. Before the days of IPv4 pool saturation, you would get a public IPv4 address (or even more than one) from your ISP, while your LAN would have a private IP address from a range reserved by the IETF (such as 192.168.x.x or 10.x.x.x). When these addresses became more scarce, ISPs moved to dynamic allocation, so unused addresses in their range would be recycled for other customers to use based on uptime. However, each customer still received a unique public IP address. Eventually, people decided that the principles used on large enterprise LANs could be applied to ISPs as well. On a service with CG-NAT, your public IP address is now shared with many other customers.
 * This is bad for several reasons, and performance and reliability are two of them. For instance, you could have trouble transmitting UDP packets across two routing tables. On a poorly configured network though, security is an even bigger concern, because you can expose multiple customer subnets to each other. The firewall on their router is a major cause for concern. The default is to allow all connections, rather than only established or related connections, while blocking others.
3. IPv6 was introduced with the aim of mitigating the shortage of network addresses, and to also reduce the workload on network infrastructure, by changing the way addresses are assigned. I will not get into too much detail as I am no expert on IPv6 networking and haven't really messed around with it until I got Jio, but I can assure you that they are not following the guidelines or best practices for deploying IPv6.
 * For instance, WAN is assigned in a stateful manner, with only a /128 address being given to your router. Your LAN is by default configured to be stateless, with a /64 prefix length. However your LAN prefix is not assigned by the ISP, but is instead assigned from a reserved linked-local IPv6 range defined in an outdated RFC. So you literally get none of the benefits of IPv6, and all of the downsides of IPv4, as a NAT is involved in your connection.
4. Bridging mode is completely broken. You still need to configure your WAN interface even when you want to bridge the Jio router to your own equipment.
5. Jio's customer service is brain-dead retarded, and will simply refuse to help if you want anything more than basic troubleshooting. They also don't have any L2 or higher technicians available on the phone. Also, the best part is that their TSP and ISP divisions are separate, yet they seem to use the same customer care number! God help you if you call from your registered mobile number, because then you will be quickly connected to a human from one department, who will promptly refuse to look at issues involving the other department, and you will completely fail to connect to that particular department. They won't even transfer your call! Also when you use a non-registered number to get around this and provide them your registered mobile number, they have no means of identifying which service tickets belong to which department.
 * When I raised a complaint with the fiber department, and then called the jiofi department to register a separate complaint, the jiofi team would insist that the ticket was raised for jiofi, and when I raised a ticket with the jiofi team, the fiber team would insist that the ticket was raised for fiber!

I will admit that I am still using the JioFi connection, but that is because I paid for a year of service, and that only gets used for things like netflix and amazon prime when I am on the move. It's not ideal, but I'm kinda stuck with that one."
Policy/Economy,0.0,4.382542027855193,3.4317718940936865,1.0072507539322055,"Superheroes in their capes. The ones who fought the crypto battle for 1.3 billion people. Because of them, bitcoin is now legal to trade in India."
Non-Political,0.0,1.4776762236286165,3.4317718940936865,0.986542268571074,Best 10 year challenge feat. Gujjuboi No. 1
Non-Political,0.0,1.3232021665945184,3.4317718940936865,0.9889913920759161,Every school ever
Non-Political,0.0,1.5100780990065004,3.4317718940936865,0.9965264334736014,Swiggy now delivers fresh fish?!
Non-Political,0.0,1.3307374864498402,0.0,0.9928628642977412,Spiderman spotted inside Delhi Metro
Politics,0.0,1.0775507393110257,3.4317718940936865,1.0028493339047442,The country is not your property.
AskIndia,0.0,1.8597169402934348,3.4317718940936865,0.9993778401866463,"The missing autistic kid case, desperately need your help please take a minute out of your busy life and help.Made a post couple of days back about tarun Gupta missing frim CST station, its been 12 days and we are starting to lose hope can you guys please help us by a sinple retweet and maybe tag fadnavis and PMO the chances are low they will notice butbit seems like our last resort. Please help here's the link to the tweet please retweet it and tag CM fadnavis

https://mobile.twitter.com/vinodd2017/status/1183373273284759553

Link to the original post 
https://www.reddit.com/r/india/comments/dgs26z/railway_police_sent_missing_autistic_kid_on_some/?sort=new

http://imgur.com/gallery/1nqesy5

Edit update: some good news guys some news channel have agreed to run the story will update you guys soon"
Food,0.0,1.4701409037732946,0.0,0.9831829585538824,Standard Hot Chips Counter.
Non-Political,0.0,2.0654311723437213,0.0,0.9596471357878049,A coconut vendor celebrating Deepavali in Bengaluru !!
Non-Political,0.0,1.2342853923017205,0.0,0.9959688190361539,Elderly couple in TN uses plastic furniture to fight off armed intruders
Coronavirus,0.0,1.5794030416754616,10.29531568228106,1.0080960849282976,"Corona has proven that India's bigger problem is not illiteracy, it's stupidity of literate people.Post lockdown announcement, people running to homes, ignoring the possibility of them being the carrier is just ridiculous. There's no existential crises and it's not vacation for god's sake. But nah, ""We gonna have a family reunion"""
Politics,0.0,1.1521504058787122,0.0,1.0063043390939965,Deccan Herald Speak Out: 17th February 2020.
Non-Political,0.0,1.496514523266921,3.4317718940936865,0.9334532546656047,"A few days ago, I shared the first of my India based comics - Brown Paperbag. The response has been overwhelming. I owe a lot of it to Reddit /r/India. So here are some more of them for those of you who are not on Facebook"
Science/Technology,0.0,1.0549447797450602,0.0,0.977200859856236,1960s :: Physicist C.V.Raman Teaching In Class
Non-Political,0.0,1.0752901433544293,0.0,0.9861268257102389,Currently visiting India.. this room I'm using to code in was bleeding Cyberpunk vibes. The camera surveying the room in the top-right was the icing on the cake.
AskIndia,0.0,0.006781787869789673,0.0,1.009689266127261,"Is AliExpress a safe online market to order stuffs?My laptop screen panel's brightness control won't work. Horrible artifacts show up after 30 mins of usage.. The screen isn't available on either Flipkart or Amazon. 

I checked AliExpress site and the screen is available there. I read that freight services, Cargo and courier services will resume from 20th April.

So is it safe to order stuff from AliExpress because we have to pay first? Thanks."
Non-Political,0.0,1.4535632000915866,0.0,0.9636271746667472,"[NP] Constable Sudarshan Shinde, saving a girl caught in Kamala Mills Fire in Mumbai. Risking his life, he saved 8 lives, carrying them on his shoulders."
Non-Political,0.0,1.4708944357588267,3.4317718940936865,1.0076347521761668,"An Indian doctor chose to stay in China and treat coronavirus victims, despite his mother's pleas to return home"
Politics,0.0,1.7512083343768,0.0,0.9872371551002125,Deccan Herald's Speak Out: 7th March 2019.
Non-Political,0.0,1.7662789740874436,0.0,0.9843262713628621,Mumbai police's recent tweet on scams.
Politics,0.0,1.4821974155418096,0.0,1.0050709456096996,"Mohammed Sharif, a bicycle mechanic who has been performing the last rites of thousands of unclaimed dead bodies for the last 25 years Awarded Padma Shri."
Non-Political,0.0,1.4399996243520072,0.0,0.9884465059939341,"For people sorting by new, meet two new members of our family"
Non-Political,0.0,1.7127782031146586,0.0,0.9586542082855479,Divided by religion
Politics,0.0,1.386498853379222,3.4317718940936865,0.9869267006567279,Indian graffiti artist (guesswhograffiti) demonstrating the state of Indian media in Fort Cochin.
Politics,0.0,1.3653999577843208,3.4317718940936865,1.0030378699267621,BJP It cell vs Reality
Non-Political,0.0,2.0691988322713826,0.0,0.985488669389528,Getting in on the Selfie craze [P]
Non-Political,0.0,6.107376742738366,6.863543788187373,0.997623278147739,Ganesh Chaturthi & Muharram possessions crossing each other.
Politics,0.0,2.1196854753020387,0.0,0.9742636364574127,Countries with smaller population than Uttar Pradesh.
Business/Finance,0.0,0.006028255884257487,0.0,1.0096862139682563,"Paytm placed restrictions on my bank account.I regularly do crypto trading on exchanges and regularly withdraw and deposit money to my Paytm Payments Bank Account. 
Paytm placed restriction on my bank account probably due to high number of deposits and Withdrawals on my bank account due to which I am not able to withdraw funds from my account. 

I have filed a complaint on Paytm app, Customer care number And Official Twitter channels
Can someone advice me how should I proceed further. Thanks!"
Politics,0.0,1.0730295473978326,0.0,1.0068755610206623,Breaking News.
Non-Political,0.0,2.492683808140471,0.0,1.0091638094101143,Woke up to this today. Made my day!
Non-Political,0.0,2.7338140435107703,0.0,1.001994842614849,Tesla Cyber Tuktuk
Non-Political,0.0,1.36163229785666,0.0,0.9879500237949917,[NP] NIT Kurukshetra issues official warning to students - Do not gatecrash weddings
Non-Political,0.0,2.063924108372657,0.0,0.9999815480774742,No comics today. [OC]
Non-Political,0.0,1.0956355069637982,0.0,0.989674222004468,The name of my delivery executive on Swiggy is Bright Future.
Non-Political,0.0,1.7059964152448688,0.0,0.9928949545881015,Literally any talent show here.
Business/Finance,0.0,0.006028255884257487,0.0,1.0095762013842076,Has anyone applied for a loan through WeMakeScholars?Just wondering if any of you have experience with them. Quora answers seem totally fake tbh so I am worried. Are they legit?
Sports,0.0,0.006028255884257487,0.0,1.0095139247451086,"IPL postponed indefinitely, BCCI searches for new window"
AskIndia,0.0,0.00904238382638623,0.0,1.009671606480298,"Men over the age of 30 - how did your libido change over the years?I read this article from vice - https://www.vice.com/en_us/article/yvx7nk/libido-decreases-after-thirty-876. And, I was wondering how true it is in India's context. 

My question is, how does a healthy Indian male, in a healthy relationship over the age of 30 feel about their sex drive?"
Politics,0.0,0.00904238382638623,0.0,1.0094998210733095,"Tendering process for new Parliament on, to be issued after lockdown"
Non-Political,0.0,1.1740028334591455,0.0,0.9784597113237273,Creepaid Plan
Non-Political,0.0,4.316984745113893,3.4317718940936865,0.9900910350925842,"Tigress Samruddhi with her four cubs at the Aurangabad zoo. The cubs, including two white, were born on Saturday morning."
Politics,0.0,1.6916793075197574,3.4317718940936865,1.004222176958905,An NBA activist showing black flag to Manmohan Singh in 2006. MMS encouraged dissent. Photo by Vikas Khot
Business/Finance,0.0,1.4000624291188013,0.0,0.9827537943362883,Government Employees be like
Non-Political,0.0,1.1860593452276607,0.0,0.9461773385081471,There's English...& then there's Indian judicial English. From the Indian Supreme Ct's judgment in the Sasikala Case
Politics,0.0,1.1227626584429569,0.0,1.0041738455948581,"Indian Democrazy, by Ray"
Coronavirus,0.0,0.05274723898725301,0.0,1.0094908433492509,"Coronavirus: Goa might become green zone by Apr 17, says CM Pramod Sawant"
Coronavirus,0.0,2.1626367984773736,0.0,1.0081205251010694,He knew
Policy/Economy,0.0,1.0843325271808155,0.0,0.9837926613480992,"News: India stops printing Rs 2,000 note, two years after its shock launch"
Politics,0.0,1.228257136417463,6.863543788187373,1.0021755478579284,"Rant: In India everything matters except the real issues.Have you ever felt that us Indians have this sick tendency to completely ignore the elephant in the room while we whine and get offended about every single thing that is not important? As an Indian international student; after observing the Western European education system, I am shocked to see how radically different it is than our own system. I personally think that it is due to the fact that us Indians are conditioned since we are toddlers to put our unrelenting faith in our ""elders"". The only problem is that many of our so called  ""elders"" are also normal human beings with their own problems and flaws. 

When I first went abroad, I remember how some of our jealous relatives were taunting my parents about how I will lose all my ""culture"", ""riti-riwaz"" after stepping out the country even though I was only going for a couple of months. I literally had to touch the feet of 10 thousand different people to get a proper dose of ashirwad before finally boarding the plane and literally had a back pain throughout the entire flight. Our parents have panick attacks if you don't say a proper namaste to a random ""aunty"" who you don't give a flying fuck about; you are taught fake history both at home and school where you are force-fed the idea of andh deshbhakti; you get told that countries such as US and UK are only successful because of the Indians scientists and doctors working there, and that you should feel lucky to be born in such a beautiful pure society. I also had narcissist relatives telling me that instead of feeling disenfranchised, I should be happy that at least I was born in a upper cast family. 

  
My point is simple. I really do not mind culture, traditions, riti or riwaz. I think they all have their own place and can add a certain level of beauty to a culture; however, I do believe that they should never supersede real world problems, facts and logic that this country is so deprived of.  

This is also where it gets really dark. If you are someone who has ability to think critically or you're someone with a certain level of common sense, living in India can be so overbearing because there is so much focus on symbolism. You don't touch the feet of your relatives? You scoundrel! You come late to a pooja? That's sacrilege! You hang out with non vegetarian friends? Chiee!!  You believe India can be more secular? deshdhrohi! 

I honestly do not blame Whatsapp or any big media company for the wave of anti-intellectualism in India. It is easy to make fun of these corporations by using words such as ""Whatsapp university"" and ""Facebook pathshala"" but the underlying disgusting mentality that is so pervasive in our society is the root cause of why we are not progressing on a global scale. Whatsapp university is not making us dumb, it is just spreading our omnipresent dumbness in a more effective manner. 

Many of our parents or relatives get triggered if you don't put a tika on your forehead after a religious ceremony but they spit out pan openly in the streets with complete impunity and disregard for local laws. Another real life example is of a person I know who got into an accident due to open potholes in the monsoon season. Instead of blaming the municipality for this, he believed that it happened to him because he did not brake a coconut after purchasing his vehicle. 

In schools you they force you to sing absolute bull shit slogans like ""bacche man ke sacche"" when this country has  one of the highest rates of rapes of underage girls, and in many schools in India if you dare to question your teacher, you get harassed and abused mentally, emotionally and physically. 

You go to a wedding in some parts of the country and it is a common sight to see hungry kids gathering around the tent to look for thrown leftovers by people, while on the other hands the women worry about the colors of their sarees. I do not even understand how these people can digest that food while looking at the eyes of those hungry kids. The more you travel around the world, the more you realize how devoided people of India are of any empathy or compassion towards their fellow citizens! 

How can this country move forward when it focuses so much on frivolous symbolism and have that level of cultural baggage on its back. And yes! I know! There are other countries that have the same problem; however, I was born in India and it disturbs me that our country does not have its priorities straight, and probably never will!

The absolute worst part about all of this is that if you dissent or do not agree with the way the our society works then they point the finger at you and make you feel like as if you are the wrong one! If you refuse to partake in the mass shared delusion and psychosis of the ""cultured"" Indian society, there is something wrong with you as a person!   


I try my best everyday to remain optimistic about our country but whenever I open up the news, whatsapp, twitter; or even listen to my own relatives and friends, I feel utterly nihilistic. I hope things take turns for the better in India but I won't bet my money on it so because when you combine religion, symbolism, politics, and fake superiority complex, then you have an absolute mess and chaos on your hands.

Sorry for my prolonged rant but I do believe that if Indian society was a person, it would be diagnosed with a severe case of Narcissistic personality disorder."
Politics,0.0,1.472401499729891,0.0,0.955037322893113,"Panama Papers - In Pakistan it gets you Disqualified, In India you get to promote GST!"
Non-Political,0.0,1.159685725734034,0.0,0.9770623803869312,Balancing work an family like a boss
Politics,0.0,1.3586181699145312,3.4317718940936865,1.0031726013091857,Howdy Modi ? All PR stunt of Modiji has gone down the drain. It would be a gigantic task to rebuild his image again.
Non-Political,0.0,3.786498227299234,0.0,0.9880031204202108,"Celebrating holi amidst snowfall in Sangla, Himachal Pradesh."
Coronavirus,0.0,0.02185242758043339,0.0,1.0096732349769741,"Watch: Slaps and fistfight in scuffle between vegetable seller, Mumbai Police - india news"
Sports,0.0,1.2501095639978963,0.0,0.9879260759880119,India won 233 medals in special olympics
Politics,0.0,1.1913340691263858,3.4317718940936865,1.0051678736046346,The Fault in our Gaddaars ; credit:@nishlesh
Non-Political,0.0,1.1943481970685146,3.4317718940936865,0.9869066809618476,Genelia convention
Politics,0.0,1.1506433419076478,0.0,0.9730028676895377,Faasos trolling Modi
Non-Political,0.0,2.4987120640247285,6.863543788187373,0.989783415887258,Actual footage of people trying to prebook Avengers: Endgame on BookMyShow since yesterday
