Non-Political,0.0,1.5583041460805604,0.0,0.9943567542731944,"Friends back in village have a book club, pic from this Sunday reading under banyan tree."
Non-Political,0.0,0.05576136692938175,0.0,1.0096125079542435,Zomato App Now Shows Body Temperature of Delivery Partners
Non-Political,0.0,2.41657707760172,3.4317718940936865,0.9974707293577368,A silver Rupee coin from 1862!
Non-Political,0.0,1.08583959115188,0.0,0.9946685655851986,Bangalore Traffic at it again
Food,0.0,2.3133431955838106,0.0,0.9990192000532315,This is Burger King's Chicken Tandoori Grill burger. What they advertise is above and what they delivered to me today is below.
Politics,0.0,1.957676098412619,0.0,0.9528919350107035,Bengaluru traffic cop stops President’s convoy to let ambulance pass; wins hearts and reward too
Coronavirus,0.0,0.03315540736341618,0.0,1.0095539698600529,Ahmedabad Mall Turns Into Temporary Shelter for Migrant Workers
Non-Political,0.0,1.6321502806627146,0.0,0.9994451072774735,Mother Tongue by Region based on 2011 Census
Non-Political,0.0,1.4754156276720198,0.0,0.9496344372062124,Respect for whoever did this.
Coronavirus,0.0,5.651489891491394,0.0,1.008114838721465,"""Elders Must Be Respected In Group"""
Politics,0.0,1.0594659716582533,0.0,0.9052614912003533,"Mods are sleeping, upvote this lotus to the front page"
Coronavirus,0.0,4.01255782295889,0.0,1.008226789598237,"A Manipuri girl at Vijay Nagar, Delhi was spat on by an middle aged man and shouted at “Corona” before fleeing on his white scooty."
Non-Political,0.0,0.0007535319855321859,0.0,1.009500840155995,"Shame On you (Godi)Media and A fun ""discussion challenge"" During Lockdown.TLDR:-> A Mother called his son ""Anti National"" while they are having a religious discussion and son put up some facts about Muslim. 

Now the Challenge:--> Discuss any religious topic with your family member. Ask a lot of why? and Share your outcomes. 

\----------------------------------

Full Story

\----------------------------------

A thought occurred in my mind.

We know Rama as a ""Maryada Purushottam"" and ""Ideal Person"". So What did he do So that we can call him a ideal Person.I searched my mind and only able to figure out some like left kingdom, left his wife as a king etc.

I couldn't find any other thing.

So I went and have a discussion with my Mother. I told her ""what did Rama do? And Why should I follow him? There are a lot of people like Gandhiji, Bhagat Singh etc and these people did this kind of work.That's why someone should follow these people. So What about Rama?""

My mother told me ""Rama Left the kingdom, left his wife as a king and he is a god who took birth as a human for us. So we should workshop him. And don't ask these type of question about religion and to religious people(i.e priest)?"".

 I quietly asked ""Why should not I asked question about religion and to priests?"" Mother told me ""Because they are always right we should do as they told us to.""

I told her ""if I got infected from Corona and A priest say that God chose me for his work. Now spread that virus and do your duty"" So that will be right?

She thought for a second then said ""No, you should ask question.""

So I told her ""Maa, There are a lot of people who think that whatever their religious leader saying is right. They neither ask question nor actually think about that. They just do whatever their religious man is saying. And These people belongs to every religious Hindu, Muslim, Sikh etc.. And These Tablighi Jamaat are also such people""

As Soon as I put up the Muslim reference(and other fact about them) in our discussion She said ""*So Now you have became anti-national also"".*

I was like WTF. **I live in a remote village. On daily basis my mother watch a little news on these shit channels. You can imagine the kind of damage Godi media have done that ""A Mother is calling his son Anti-National"".**

To Godi Media: I will do what ever in my control to stop you. and If any person from Godi Media is reading this ""Shame On you"".

Ok Done.

**Now come the Challenge Part:**

Discuss any religious topic with your family member, ask a lot of why?  And share your thought."
Coronavirus,0.0,0.01431710772511153,0.0,1.0096534811850668,Coronavirus | Community transmission happens in Kashmir hamlet
Sports,0.0,1.8069697013061816,0.0,0.9889347362948757,Live IPL score on a taxi in Hyderabad
Politics,0.0,3.960564115957169,6.863543788187373,0.9868466759483855,#Profile4Peace #SayNoToWar (x-post from /r/pics)
Non-Political,0.0,1.5801565736609937,3.4317718940936865,0.9834967889473123,"Thank you, from a foreigner in HyderabadTwo Mondays ago, I finished at the gym and waited nearly 1.5 hours for an Uber to pick me up. Traffic was insane, I was tired, and there were a ton of people in the street. When my Uber arrived, I looked around and realized the super nice, noise canceling headphones I bought before I left the U.S. were gone. I probably got distracted and someone picked them up when I wasn't looking. I was angry at myself for being dumb. I've since been pricing new headphones.

Last night, I got done at the gym and went to the supermarket next to the gym to grab some food. After checking out, the cashier pulled me over to the side of the store and took my headphones out from a cubby by the counter. He saw me drop them nearly 2 weeks ago and grabbed them for me. I'm completely shocked, grateful, and appreciative as this would be a highly unlikely scenario in the U.S. Living/working in India has already been an amazing experience and this only makes it better."
Sports,0.0,1.1981158569961756,0.0,0.936281496013432,Our girls running the marathon had no one to give them water during the race. The Indian desk at the race was unmanned. - @bhogleharsha
Non-Political,0.0,1.1009102308625236,0.0,0.9876879051684747,Trashtag challenge completed!
Non-Political,0.0,1.5620718060082213,0.0,0.9851615788346866,[Meme] Every Indian childhood ever.
AskIndia,0.0,0.010549447797450602,0.0,1.009511415842417,"Issue with ICICI bank. Cant reach anyone.So I made a purchase last month and converted it to EMI from Amazon. Due to some technical reasons I had to return the device and Amazon refunded the entire amount. They sent me a reference number as well.

Its been over 15 days and I havent received any credits to my card. No one is available over the customercare helpline either. Its absolutely nuts.  I even tried to go via the 'Fraud' option and it just said no reps available and hungup.

The ICICI twitter handle is another shit show. They replied to my initial message of changing my mobile number. However since then when I approached them again regarding this issue, they just refuse to reply. Its been three days now.

I tried sending a message from another twitter handle. Got an immediate reply. Later When I gave them my details, they stopped replying.

What do I do?"
Non-Political,0.0,1.1506433419076478,0.0,0.9620118344626216,"Fuck people who behave like thisThe semester is finally over and I'm heading home. The journey takes 46 hours via train. Usually I travel with friends/classmates but I had to stay back a few days so I'm on my own. 

Anyway, I was allotted a lower berth in 2nd ac. Perfect, I thought. I've got a bad back and climbing into the upper berth does it no favours. Things were going well till my berthmates arrived. 

It's a family. A couple and 2 kids. They ask me if I can move to the upper berth to feed their kids and I can come back down after. I'm like ok, cool. I've travelled with kids before so I know how it can be. 

Nope. After dinner, they put the kids to sleep. In my berth. Refusing to give it back. Ok, whatever. I'm not going to see them again after I get down. All good, right? 

Nope. They've decided they want the entire fucking thing to themselves so they've been making life hell to get rid of me. Thankfully, I have a friend in another berth so I've been staying there but whenever I come back to get something or to lie down, they begin shouting, playing music, beating the kids (?!) until I leave. They woke me at 5 in the fucking morning blasting shitty music till I got up and left. 

This is a seat that I've paid a fair bit of money for. How in the fuck can people justify this sort of behavior? Fuck this and fuck them. I'm getting down in 6 hours. 6 long, miserable hours."
Politics,0.0,2.452746612907265,3.4317718940936865,1.0036676210417774,AAP's response to BJP's Prakash Javdekar.
Sports,0.0,1.9313024789189923,0.0,0.972014469443661,"Abuse us, criticise us but please come watch Indian team play: Sunil Chhetri appeals to football fans"
Non-Political,0.0,1.3601252338855956,0.0,0.9514065202154126,Somewhere in Kerala
Science/Technology,0.0,0.024866555522562134,0.0,1.0096838863630462,"Do you guys have questions for your OBGYNS that they do not have time for? I'm an OBGYN and I have the answersHey Guys,

As an OBGYN resident doctor, I realised the lack of credible and evidenced based information about pregnancy and contraception to women directly. As doctors we want you guys to have a ton of information but we don't really have a lot of time to run you through all this.

Soooo I developed a completely free (ad free! bias free! random product advertising free! affiliate link free!) app to track vitamins, sonographies, doctors appointments; answer all your FAQs, ideal diet, prenatal yoga exercises, updates on growth of your baby, how to deal with everyday problems in pregnancy and when to ask for help and go to the doctor immediately.

This app also tracks your periods, tracks your birth control pills, gives you medical valid information about different methods of contraception, and answers your FAQs

This app is available in English, Hindi and Marathi because I didn't want ANY indian woman to miss out on knowledge just because she is not comfortable with English.

I'm doing this because as an OBGYN I truly believe that we need to empower ourselves and this is only done when the correct information is given to YOU.

YOU are in charge of your body.

Please download from the link and let me know what you think!: [https://play.google.com/store/apps/details?id=com.pivot.kreya](https://play.google.com/store/apps/details?id=com.pivot.kreya)

xx

Dr. Esha Chainani"
Politics,0.0,1.2433277761281067,3.4317718940936865,1.0028447563023688,Step aside Nathuram. We have new hindutva terrorists and they come in uniforms.
Politics,0.0,3.1844261708590174,0.0,1.00847877274134,Go Save the world!
Non-Political,0.0,1.9493872465717648,0.0,1.0056586757852877,"5-year jail term, Rs 50 lakh fine for ads promoting skin fairness, govt proposes"
Non-Political,0.0,0.02034536360936902,0.0,1.009565398598835,Bengaluru Cop Rescues Calf From Speeding Car. Now They Are Inseparable
Business/Finance,0.0,0.1853688684409177,0.0,1.0096700912150314,"Did I just got screwed by my friend over EMI payments and is their something I can do?So one of my close friends went shopping for a laptop. There was an offer by a bank in which I have an account so she requested me to get the offer from my card and I hesitatingly accepted it. 

First 4 months she paid back the EMI amount that got debited from my account on time. 

But now she won’t accept my calls and WhatsApp is also one tick so she may have blocked me. She hasn’t paid back two EMI debits and my bank balance has gone in negative. I have to do my shopping on my credit card now. 

I went online on netbanking but I couldn’t find any option for ongoing EMIs. 

Total amount of the laptop was around 1,40,000 and she paid me back around 28,000 and now she owes me around 14,000. 

How royally am I fucked and is there something I can do about it now? There is still about 98,000 of payments left to go according to the original value of the laptop."
Politics,0.0,0.0037676599276609294,0.0,1.0097015313789843,"Bollywood backbenchers finally taking revenge on A-listers, with some Right-wing help"
Politics,0.0,1.5876918935163156,0.0,0.9383781702167547,India conducted surgical strikes last night across LoC to safeguard our nation: Defence Ministry
Non-Political,0.0,1.1491362779365835,0.0,0.9754239435197916,[NP] Hey r/India! I build and fly racing drones. Here's a short clip from my weekend at Bangalore
Coronavirus,0.0,0.013563575739579345,0.0,1.0094929673923765,"States set their sights on hotspots, show the way to manage them : At least 25 districts, which previously had covid-19 cases, have had no new cases in the last two weeks"
Coronavirus,0.0,5.6612858073033125,0.0,1.0083392309324066,First day of Lockdown in our city/Andhra Pradesh
Coronavirus,0.0,0.03843013126214148,0.0,1.0096097350569735,"Some colony folks had put up barricades blocking locality entrances without any permission from the police or any other authority.Another incident from my locality, after the last two that I had posted earlier. Some people hsd closed a bunch of colony entrance roads with bamboo barricades with help from a friend of mine who runs a decoration business. This happened 2 days ago, without any permission from police, and now if anyone needed to go out to buy essentials, they would be forced to use a gulli (small road) just beside the barricade. 

Note: One of those people had stated two weeks ago on the colony WhatsApp group that he had seen a vegetable vendor licking the vegetables, and when he screamed and tried to catch him, he ran away. (I and many of my friends don't believe him, as he is a far right wnger who wants the complete destruction of muslims, judging from some of his past WhatsApp forwards. Also, there's no way a vendor with a heavy vegetable carrying thela can outrun the man who ""saw him licking"")

The problem with the barricades? The people living around that gully road began having problems with everyone going from that side. Infuriated, they put up a barricade as well. 

One of my friends who lives just beside the barricades, just called me and told that a couple of police vehicles arrived and those people were called. They were scolded heavily and were warned to not do anything like this again. The barricades were then removed. 

I was extremely angry at the fact that they didn't even think of other people who live there, while putting up barricades without permission. It was an unnecessary move that didn't serve any purpose. Someone from the colony had reportedly phoned the police yesterday and I'm glad that they were removed."
Coronavirus,0.0,0.027880683464690876,0.0,1.0095896861000435,"Baby born inside labourer’s shanty in Pune, family gets medical help after 20 days"
Non-Political,0.0,2.449732484965136,0.0,0.9917375762752134,I stuffed most of Europe inside India
Scheduled,0.0,0.006781787869789673,0.0,1.0095462650351539,"Random Daily Discussion Thread - April 16, 2020 at 09:15AM^Beep ^Boop ^Bot, ^I ^am ^a ^bot! ^if ^any ^problem ^askaway ^my ^creator"
Coronavirus,0.0,0.019591831623836833,0.0,1.0096255588283867,"Indian fishermen, caught out by virus lockdown, dock after weeks at sea"
Non-Political,0.0,2.6388690133337147,0.0,0.9744238137365319,How to get more volunteers for 'The ugly Indians' cleanup campaign? Below was result of 3 hour and 15 volunteers
Non-Political,0.0,0.011302979782982787,0.0,1.0096904671435596,"People in India can see the Himalayas for the first time in 'decades,' as the lockdown eases air pollution"
Coronavirus,0.0,0.015070639710643718,0.0,1.0096773895518927,Drone Patrolling
AskIndia,0.0,0.006028255884257487,0.0,1.009674156731538,"Are flights from India to Canada banned?Goibibo, TripAdvisor and Makemytrip show flights from New Delhi to Canada for early May."
Politics,0.0,5.7042371304786466,10.29531568228106,1.0027342742532626,Weighing us down?
Non-Political,0.0,1.1205020624863604,0.0,0.9723366096230597,A monk in Mumbai
Policy/Economy,0.0,0.03315540736341618,0.0,1.009506097782959,Lockdown 2.0: Govt bans sale of booze and tobacco
Non-Political,0.0,2.408288225760866,0.0,0.9750385521478143,"A misty morning in Idukki,Kerala."
Non-Political,0.0,0.03240187537788399,0.0,1.0096766382805746,"Militants attack CRPF party in Sopore; two troopers killed, another wounded | Greater Kashmir"
Politics,0.0,1.1755098974302098,0.0,0.9694764700965892,"Manmohan Singh on Kathua, Unnao rape cases: ""PM Modi should follow own advice to me, speak more often"""
Coronavirus,0.0,0.011302979782982787,0.0,1.0096333915157198,Gujarat Institute Identifies 3 New Mutations Of Novel Coronavirus: Report
Coronavirus,0.0,0.02185242758043339,0.0,1.0096827082474822,"Sanitation Workers Attacked With Axe, Clothes Ripped in MP’s Dewas"
Coronavirus,0.0,0.008288851840854044,0.0,1.0094905481842282,Quarantine caste abuse complaint
Non-Political,0.0,1.6668127519971951,0.0,0.9890491439115553,"GoT theme song played by ""Arambh"" band using bulbul and dhol tasha in dombivali, India on the occasion of gudi padwa. Thought reddit should see this."
Photography,0.0,2.055635256531803,0.0,0.9986115173607372,Mangroves in Mumbai. Poco F1 (3024x4032)
Non-Political,0.0,1.3917735772779474,0.0,0.9696587707575058,Me and my 10th std books(ICSE) [I am 5ft 10in]
Non-Political,0.0,1.1016637628480557,0.0,0.995932377606237,"Boxer swims 2.5km in flood water to join his team, wins SILVER in state level championship"
Non-Political,0.0,1.406844216988591,6.863543788187373,0.9888874679065889,"Friends, Indians, countrymen, I cleared UPSC CSE 2018.I am also super happy as I got the rank which will get me into my top preferred service (can't say more as I would want to continue with this account even after I join the yours truly Government of India).

Posting it here as Reddit in general, and this community in particular, have been a refuge over the last year as I shunned the rest of social media to prepare for civil services. It's great to know that so many level headed and witty people are out here, rising above the petty politics and crass humour that otherwise dominates our discourse.

Keep doing you, y'all.

&#x200B;

Edit: Well they did tell me I will get some gold if I clear this exam /s :D

Thank you for the gold internet strangers and everyone else for the heartwarming wishes. Forever in your service, starting this August.

&#x200B;

Edit 2: I am doing an AMA here [https://www.reddit.com/r/india/comments/bapwin/hi\_i\_cleared\_upsc\_cse\_2018\_ask\_me\_anything/](https://www.reddit.com/r/india/comments/bapwin/hi_i_cleared_upsc_cse_2018_ask_me_anything/) 

Happy to respond to all and any queries. "
AskIndia,0.0,0.01281004375404716,0.0,1.009518087589737,"Best Android phone to buy after lockdown endsCamera is the most important feature.

Use it mainly for reading and clicking photos

Not looking for gaming

Budget below 70k

Can wait 2-3 months if new phone with great features is releasing.

Already looked at p40 pro but it doesn't support google services (read play store)"
Scheduled,0.0,0.00904238382638623,0.0,1.009656175202029,"Random Daily Discussion Thread - April 18, 2020 at 09:15AM^Beep ^Boop ^Bot, ^I ^am ^a ^bot! ^if ^any ^problem ^askaway ^my ^creator"
Politics,0.0,1.2749761195204585,6.863543788187373,0.9978216595772007,Is this what we are morphing into?
Politics,0.0,2.646404333189037,6.863543788187373,1.0009363649407215,State of the Republic
Politics,0.0,2.14756615876673,6.863543788187373,0.9968722784577415,Every single day this spot is absolutely cleaned by the garbage collection guys only to be again dumped with garbage by the end of the night. When will we learn some civic sense to not throw garbage right in the middle.
Non-Political,0.0,1.8340968527853403,3.4317718940936865,0.9947699070605786,1
Non-Political,0.0,3.4330917260846388,0.0,1.0008628014201677,Only in India would this be proudly advertised
Non-Political,0.0,1.4935003953247923,0.0,0.990716233414353,Let's all take a moment to appreciate the Dev Team's commitment here
Politics,0.0,1.3932806412490117,0.0,0.9717931605621681,"India would be much better off if people were offended by litterers, bribes, violence instead of not standing for national anthem, flag.I believe we must respect national anthem and flag but I think not respecting flag and national anthem is a much smaller issue compared to garbage corruption etc. But this doesn't mean it is okay not to respect national anthem , flag"
Non-Political,0.0,1.102417294833588,0.0,0.9841901334936608,Goa Police crowdfunding traffic management
Non-Political,0.0,1.9252742230347348,0.0,0.9902267391200931,[OC] Lightning in Bangalore today
Coronavirus,0.0,0.01281004375404716,0.0,1.0096706344713444,"Kanungo is fourth Covid fatality in Ludhiana; four contacts of infected ACP, district mandi officer also positive"
Non-Political,0.0,0.01281004375404716,0.0,1.0095594475885208,"MHA issues advisory, says Zoom not secure video conferencing platform for private individuals. Mentions guidelines for those who still want to use it."
Non-Political,0.0,1.6110513850678134,0.0,0.9894311955930836,Life savers!
Coronavirus,0.0,0.0,0.0,1.009625616080223,"Test not, find not: The government’s failure to detect, trace and isolate infected persons in the nearly two-month-long window of opportunity it had to protect people from the coronavirus shows its irresponsible handling of the COVID-19 crisis."
Business/Finance,0.0,0.05425430295831738,0.0,1.0094888147258525,"Airlines decline refund to customers for cancelled tickets, offer rescheduling"
Politics,0.0,4.1617571560942626,24.022403258655807,1.0066969403805548,Modi: Last Week Tonight with John Oliver (HBO)
Politics,0.0,1.3284768904932436,0.0,0.9958578293540994,Running in circles gets you nowhere
Politics,0.0,1.1197485305008281,3.4317718940936865,1.0030290785892373,best placard i saw on the Internet from todays protest
Politics,0.0,0.006781787869789673,0.0,1.0096593176917086,Arundhati Roy: India using coronavirus to mistreat Muslims
Coronavirus,0.0,0.015070639710643718,0.0,1.0095548210040186,"COVID-19 | State-wise tracker for coronavirus cases, deaths and testing rates"
Photography,0.0,1.4972680552524533,0.0,0.9794946565847539,The neighbor kids and my puppy fell in love with each other at first sight
Non-Political,0.0,1.2071582408225618,0.0,0.9790578460663603,"My uber driver last night, Rakesh, carries his own water from home in a thermos and a cup, do reduce waste generated by bottles."
Coronavirus,0.0,0.007535319855321859,0.0,1.0095895696879764,Bought air tickets during lockdown? Full refund likely - Times of India
Coronavirus,0.0,0.0030141279421287436,0.0,1.009670298593905,"Covid-19 lockdown: UP sends 250 buses to Kota to evacuate 7,500 students; Bihar CM questions move"
Non-Political,0.0,0.008288851840854044,0.0,1.0096558049734876,Delegating Specialized Clinical Work To ‘Technically Qualified’ Is A Terrible Idea
Non-Political,1.0,0.8545052715934988,0.0,1.0094947670084298,"/r/IndiansGoneWild is apparently blocked in India [NSFW]Opening /r/IndiansGoneWild (NSFW) today gives me an info page stating - 

> ""This content has been restricted in your country in response to a legal request.""
> ""Geoblocked in India due to General legal request""      

Anyone else in India getting this message?"
Coronavirus,0.0,0.0037676599276609294,0.0,1.0094943738791542,Coronavirus Lockdown: The Seven and a Half Things that Modi Said and Did Not Say
Non-Political,0.0,1.7692931020295724,3.4317718940936865,0.9945440434774446,"Sacred Games season 1 fanart poster, by me"
Non-Political,0.0,1.3277233585077115,0.0,0.9688748538061797,Hostel life at IIT Madras.
Non-Political,0.0,2.2960119599165703,0.0,0.9933407307440548,Bengaluru City Police
Non-Political,0.0,1.3601252338855956,0.0,0.9717361211938247,Shitpost
Politics,0.0,0.017331235667240274,0.0,1.0096244481427632,Why terrorism needs hate to thrive: A case of the Kabul attacks
Non-Political,0.0,1.2418207121570424,0.0,1.0058393543108435,School Report card from pre independent India
AskIndia,0.0,0.0007535319855321859,0.0,1.009556548737211,Make cigarettes essential itemsDo not understand why the govt has put a ban on Liquor and tobacco. And why isn't anybody making a petition to allow these items. Not only are they revenue generating but difficult to give up during these rather difficult times. Seems like a case of moral policing.
Non-Political,0.0,0.0,0.0,1.0096279258737506,"PSA for Indian Gals using Tinder PassportThe rest of the world doesn't find the Indian traditional dress attractive, and the sapiosexual shit is weird.

Signed, westerner seeing a lot of otherwise cute Indian gals on Tinder these days

PSA for Indian dudes, stop being such creeps."
Non-Political,0.0,1.2983356110719562,0.0,1.000641412386104,"Maharashtra Man with Rs 3 in His Pocket Returns Rs 40,000 Lying at Bus Stop, Refuses Any Cash Reward"
Coronavirus,0.0,0.019591831623836833,0.0,1.0095840544277492,How India's Kerala state 'flattened the curve'
Non-Political,0.0,1.0572053757016568,0.0,0.9744779866962728,"Accept gay relationships; all suppression is wrong, says Supreme Court"
Politics,0.0,2.2726524683650724,3.4317718940936865,0.9872855163624406,The Times Of Modi!
Non-Political,0.0,1.2305177323740595,3.4317718940936865,0.9967626462803382,Paragliding the first time.. what could go wrong
Photography,0.0,1.455823796048183,0.0,0.9995997171335813,"Dog found in Jaipur (OnePlus5, 1306x979)"
Coronavirus,0.0,0.03240187537788399,0.0,1.0095198700302392,#WATCH Chhattisgarh: The nursing staff at AIIMS (All India Institute Of Medical Sciences) Raipur taking care of a 3-month-old daughter of a woman who has tested positive for COVID-19. (Video source: AIIMS Raipur)
Non-Political,0.0,3.8158859747349894,0.0,1.0006771184479906,Welcome to Indian Education where they make you write code with hand.
Coronavirus,0.0,0.4415697435218609,0.0,1.0094946346930749,All 5 who died of COVID-19 in Bhopal were gas tragedy victims
AskIndia,0.0,0.012056511768514975,0.0,1.0095008948633053,"Looking to volunteer for non profit organisation in human trafficking domainCan any experienced person tell me about organisations working to stop human trafficking, which organisations are doing well and who should I volunteer for."
