AskIndia,0.0,0.009795915811918417,0.0,1.0096371256077077,"Where can I get pet food during this shitstorm?Hi, I live in Chennai and recently a kitten wandered into my house and refuses to leave. I don’t have anything to feed him as all I’ve got are adult food for my adult cat. Is there anywhere I could get some food for the kitten? If not, is there an alternate food I could feed him for now?"
Non-Political,0.0,1.7037358192882723,0.0,0.9915698379369176,Youth gathered yesterday in from of Palika Market- Delhi for a silent protest against climate change and to save our mother earth.
Non-Political,0.0,3.4926207529416815,0.0,0.9921733276346362,Spotify after two songs
Non-Political,0.0,1.1378332981536006,3.4317718940936865,0.9888591479677126,Being an RCB fan hurts...
Non-Political,0.0,0.012056511768514975,0.0,1.0096295543704268,15 things to do if you are fired
Sports,0.0,1.622354364850796,0.0,0.9728347947460654,"These Indians in Russia with banner saying ""India coming soon!"""
Non-Political,0.0,1.1408474260957293,3.4317718940936865,0.9898382338843542,I think they stopped doing this nowadays.
Coronavirus,0.0,0.0587754948715105,0.0,1.0095028725961825,Anatomy of an ‘investigation’: How India Today’s madrasa sting misled its viewers
Politics,0.0,1.0707689514412362,0.0,1.003149624875028,Why is that?
Coronavirus,0.0,0.00904238382638623,0.0,1.009619773212266,Lockdown double whammy for Karnataka’s ASHA workers
Politics,0.0,1.2252430084753343,0.0,1.0028337162399414,Gujarat Model Implemented all over India successfully
Politics,0.0,1.2342853923017205,0.0,1.0044932548616667,Deccan Herald Speak Out: 15th January 2020.
Non-Political,0.0,1.0850860591663476,0.0,0.9947199471998556,Saw this guy eating on the platform but didn't realise he just freakin' left it on his seat until I got off my phone and looked around a bit.. What the hell is wrong with these people?! How hard is it to take it with you and just throw it in the dustbin instead of a metro seat.
Politics,0.0,2.7172363398290624,3.4317718940936865,0.9977908370969479,From @PonnappaCartoon
Coronavirus,0.0,0.0022605959565965574,0.0,1.0097047597464184,"Difference in number of COVID-19 cases between ICMR and MOHFW. Source in comments.Yesterday at 5PM MOHFW press release reported 14792 COVID-19 cases. Add all the numbers in the below link. 

https://www.mohfw.gov.in

Yesterday 9PM ICMR press release reported 16365 cases. Open the first pdf in the below link. 

https://icmr.nic.in/content/covid-19


Difference of 1500+ cases in 4Hrs."
Politics,0.0,0.004521191913193115,0.0,1.0095699087712702,"By arresting journalist for Bandra gathering, government is scapegoating media for its own failures"
Coronavirus,0.0,0.38656190857801137,0.0,1.0096107089743216,Current state of T2- Mumbai Airport
Non-Political,0.0,1.1544110018353086,6.863543788187373,0.9860753734849839,"SHITPOST ALERT: I waited for a year to post this.What do you call a strand of hair found on Valentine's Day? 

Love-day-ka-baal. 


Edit: Removed all other edits. 🤷🏻‍♂️"
Coronavirus,0.0,0.10700154194557039,0.0,1.0096663800237782,"Andheri lawyer moves intl court against China over coronavirus. Ashish Sohani, who practises in the Bombay High Court, files petition in the International Criminal Court saying China’s actions amounted to crime against humanity."
Coronavirus,0.0,0.02335949155149776,0.0,1.0095752573650407,India fixes data privacy flaws in aarogya setu coronavirus app
Non-Political,0.0,2.0624170444015926,10.29531568228106,1.0073731475439132,Good evening India. You might remember I posted her half finished a while a go? Here she is! My finished Lakshmi Diamond Painting.
Non-Political,0.0,1.4505490721494578,0.0,0.9687858373788854,Saw this on Twitter
Coronavirus,0.0,0.053500770972785196,0.0,1.009647329157194,"Under India's caste system, Dalits are considered untouchable. The coronavirus is intensifying that slur"
Politics,0.0,2.413562949659591,17.158859470468432,1.0056045568967253,I am afraid of the DLCs.
Politics,0.0,0.09795915811918417,0.0,1.0096236625203432,Manipuri PhD Student at JNU Arrested for Year-Old Article Critical of BJP-Led State Govt
Coronavirus,0.0,0.11227626584429569,0.0,1.0095580919922642,Doing the maths: Why India should introduce a Covid wealth tax on the ultra rich
AskIndia,0.0,0.01431710772511153,0.0,1.0095200099791724,"What are you watching?Just to talk about something else other than the news. Which movies or TV series did you recently watch/are watching these days? 
I have been bing watching Kim’s Convenience on Netflix - a sitcom about a Korean-Canadian family that owns a convenience store in Toronto. Really funny and entertaining! 
Maybe I’ll watch The Office next - I’ve heard it’s a classic!"
AskIndia,0.0,0.009795915811918417,0.0,1.0096049042742554,"Survey about Salary cuts and Layoffs in the corona timeWe are doing a survey about how corona is affecting employees in companies via salary cuts, layoffs or other measures. All responses will be confidential and private. Please take a minute to fill this survey if you are affected.

https://docs.google.com/forms/d/e/1FAIpQLScmqvdEaBtxhaGVRs5MS7xsz8jwiDBvqzpKbtJJEmL1Qcs_DA/viewform?usp=sf_link"
AskIndia,0.0,0.007535319855321859,0.0,1.0095880137102928,"How can I contribute for the goodwill of the society in India?It is my ultimate goal that I do things for the betterment of the society. Whenever I ask this to anyone, they say get a government job. However, I feel, apart from some services, government servants do not get the chance to do their part and a lot of them don't even have the motive. 

I am a student at one of the old IIMs, and I believe that I can't use my talent and knowledge for my personal benefits only. It gives me utmost satisfaction when I help people. What are the ways I can do it? Tell me something that can ensure greater impact."
Non-Political,0.0,4.321505937027086,0.0,0.9551477063418344,Hindu cop standing guard as Muslim comrade offers namaz (photo shared by Srinagar Sector CRPF on Twitter)
Non-Political,0.0,0.0007535319855321859,0.0,1.0097040460068596,House Boat Adventure | Backwaters |Kerala | Alleppey
Non-Political,0.0,3.6636725136574877,3.4317718940936865,0.9874869505870384,"The Trend is spreading to Dimapur, Nagaland."
Non-Political,0.0,1.856702812351306,3.4317718940936865,1.005450352256392,"Rape of 7-year-old in Bengaluru: Lack of medical report and top lawyer's defense gets accused off the hook. The defence first suggested that the child – the seven-year-old – was sexually active. When this line was objected to, the defence maintained that she had a vivid imagination. [Sept. '19]"
Non-Political,0.0,0.012056511768514975,0.0,1.0096134246197552,Indian Air Force AH-64 Apache Makes Emergency Landing
Politics,0.0,1.1928411330974502,3.4317718940936865,1.002868313524599,I'm at India Gate protesting this fascist regime and their attempt to destroy the basic structure of our Constitution.
Coronavirus,0.0,0.03315540736341618,0.0,1.009621785296245,"Rs 500 notes lay on Delhi street, no one touches due to coronavirus fear - india news"
Coronavirus,0.0,0.007535319855321859,0.0,1.0095721129669664,India coronavirus: Tablighi Jamaat leader on manslaughter charge over Covid-19
Scheduled,0.0,0.013563575739579345,0.0,1.009628705770987,"Late Night Random Discussion Thread !^Beep ^Boop ^Bot, ^I ^am ^a ^bot! ^if ^any ^problem ^askaway ^my ^creator"
Politics,0.0,1.2862790993034412,0.0,0.9818965555943837,Land of Statues.
Politics,0.0,1.2350389242872526,3.4317718940936865,1.0029012314220591,CAB explained in one picture!
Non-Political,0.0,2.562762282794964,0.0,0.9450208781330339,Andhra Pradesh should redesign this map/logo
Coronavirus,0.0,0.0022605959565965574,0.0,1.0096813195723868,Oxford researchers' vaccine gives hope against coronavirus
Politics,0.0,1.2071582408225618,0.0,0.9820667354054307,"Farmer Gets Rs 1,064 For 750 kg Of Onion, Sends Money To PM In Protest"
Non-Political,0.0,1.2214753485476733,0.0,0.9933576849211687,Spotted in noida. Black window panes and no number plate.
Politics,0.0,1.0828254632097511,0.0,0.9873570417176232,Line of no control - Sandeep Adhwaryu
Coronavirus,0.0,0.008288851840854044,0.0,1.0096872260534953,26 navy sailors in Mumbai test positive for COVID-19
Politics,0.0,5.262667386956786,6.863543788187373,1.005326930020026,"Picture of culprit who brandished and fired gun at silently protesting student in Jamia while shouting, ""You want Azzadi? Ye lo Azaadi""."
Coronavirus,0.0,0.02034536360936902,0.0,1.009621808833111,200 Buses From UP's Agra To Be Sent To Kota In Rajasthan To Evacuate Students
Politics,0.0,4.529480765033969,6.863543788187373,1.003124448061963,"Pro-gamer move by Women of Bangalore in a student led protest courtesy of - Section 46(4) of Code of Criminal Procedure, 1973"
Policy/Economy,0.0,0.03843013126214148,0.0,1.0095667223885159,"Hit by sharp ad decline, India's newspapers cut jobs and salaries"
Coronavirus,0.0,0.06781787869789672,0.0,1.009655703828577,"""All Countries Will Face This"": WHO After China Revises COVID-19 Deaths"
Science/Technology,0.0,1.3066244629128103,3.4317718940936865,0.9971782538992353,"‘The most terrifying moments’: India counts down to risky Moon landing | If touchdown is successful, Chandrayaan-2 will be the first lunar mission to explore the south pole."
Food,0.0,1.4497955401639255,0.0,0.9855374594043965,Some of the food I ate in India
Non-Political,0.0,0.00904238382638623,0.0,1.0096245874555647,"Psychological study of Indian population (Re-post)Hi, I'm a postgraduate student of psychology and i'm doing a study on the effects of Corona virus lock-down in the psychological makeup of Indians. People who are interested and willing can fill the questionnaire that is linked below.

Thank you.

[https://docs.google.com/forms/d/1uxTXG3V7DyGP46wKaNMYDQCHkNiZsYElZCTZBLa6hhA/](https://docs.google.com/forms/d/1uxTXG3V7DyGP46wKaNMYDQCHkNiZsYElZCTZBLa6hhA/)"
Non-Political,0.0,1.0948819749782661,0.0,0.9841627022305096,Mumbai Police: When he argues to ride a motorcycle without wearing helmet #SillyBoy
Non-Political,0.0,0.018838299638304648,0.0,1.0095017689080055,Inside the thriving world of India's private detectives
Coronavirus,0.0,3.0751640329568506,0.0,1.0077485522872507,This Amazon review for top selling face mask
Non-Political,0.0,1.256891351867686,0.0,0.9883252141620089,Found at your local public urinal
Coronavirus,0.0,0.1597487809328234,0.0,1.0095055169948866,ABP Majha reporter arrested for allegedly spreading false information that prompted the Bandra chaos
Politics,0.0,2.87849218473295,3.4317718940936865,1.0041018348713304,So relevant again!
Politics,0.0,0.04521191913193115,0.0,1.0095002409201086,The Rise of a Hindu Vigilante in the Age of WhatsApp and Modi
Politics,0.0,0.06329668678470361,0.0,1.009662567687614,"‘Saw News, Can’t Trust You’: Man Accosts Muslim Civic Worker in MP"
Non-Political,0.0,1.1174879345442317,0.0,1.0011894963012073,People need to shake off this insecurity
Coronavirus,0.0,0.01281004375404716,0.0,1.009555020749314,Ayurveda Experiment on Karnataka's Coronavirus Patients? Conflicting Claims Arise on Trial Permission
Coronavirus,0.0,0.0037676599276609294,0.0,1.0097051115271458,"Little guy comes out to play: Bellandur, Bangalore.To put in context, this snake was caught in a safe  manner and no harm was done. Due to offices being empty because of pandemic situation, wildlife encroaching human establishments.

&#x200B;

https://preview.redd.it/weuqhrqocot41.jpg?width=1040&format=pjpg&auto=webp&s=4d9bc0ef944b8f0c513fe95003da9c93575a87de"
Policy/Economy,0.0,0.02185242758043339,0.0,1.0096712394324143,Dharavi’s economy goes down the tubes
Politics,0.0,1.8521816204381127,0.0,0.9564567212321334,Right To Privacy is Fundamental Right
Non-Political,0.0,2.079748280068833,3.4317718940936865,1.0017567882073788,Digital potrait of Amrish Puri in Temple of Doom by Rohit Singh
Non-Political,0.0,2.411302353702995,3.4317718940936865,0.9998153669891249,Netflix India case study.[OC]
Non-Political,0.0,1.9893244418049707,0.0,1.0094760857342553,"Act of kindness. The Hindu photographer Vijay Bate clicked this image in Juhu, Mumbai, where a resident was seen feeding a peacock residing in the area. Source : The Hindu"
Non-Political,0.0,0.42875969976781375,0.0,1.0095593508965306,Twitter suspends (Kangana Ranaut's sister) Rangoli Chandel's account after controversial posts.
Science/Technology,0.0,0.02863421545022306,0.0,1.0096667082676394,"India testing multi-purpose vaccine in fight against COVID-19. The results of the trial will be evident in six weeks, the Council of Scientific and Industrial Research (CSIR) believes."
Coronavirus,0.0,0.26825738684945816,0.0,1.009512503627306,"Coronavirus: Uttar Pradesh Man coughs during ludo game, gets shot at"
Politics,0.0,1.9320560109045246,0.0,1.0039943267370526,"Anand Mahindra - ""It doesn't matter what your politics are. It doesn't matter what your ideology is. It doesn't matter what your faith is. If you're an Indian, you cannot tolerate armed, lawless goons. Those who invaded JNU tonight must be traced & hunted down swiftly & given no quarter..."""
Non-Political,0.0,1.6683198159682595,0.0,1.0021998773438168,"Bengaluru cops pose as passengers, collect Rs 8 lakh in fines from errant auto drivers. Bengaluru autorickshaw drivers were fined for refusing to ply to certain destinations, demanding more fare and also not having valid or improper documents."
Business/Finance,0.0,1.1853058132421284,0.0,0.9862138822163383,My Uber Eats order was delivered in Zomato packaging by a guy in a Swiggy shirt
Policy/Economy,0.0,1.556797082109496,0.0,0.9741527822713707,India just approved net neutrality rules that ban ‘any form’ of data discrimination
Coronavirus,0.0,0.02335949155149776,0.0,1.0096201084535739,"3,02,956 samples tested by ICMR so far"
Food,0.0,0.006781787869789673,0.0,1.009670567041404,The sausage men of Miramar
AskIndia,0.0,0.03843013126214148,0.0,1.0095744564754645,"Did Ramayana actually happen in reality? Are their any scientific facts/ research that prove that it was real?Is it just me or all this looks really unbelievable. It looks like Harry Potter /LOTR of ancient times.
Also, i dont intend to offend anyone, this is my personal opinion, please don't take it personally."
Non-Political,0.0,1.3804705974949645,0.0,0.9867607892881405,Spotify India official pricing
Business/Finance,0.0,0.045965451117463335,0.0,1.0096392235694411,TVS Motor acquires iconic British bike company Norton
Non-Political,0.0,0.223045467717527,0.0,1.0095174005677017,Spitting in public now an offence under Disaster Management Act: MHA
Non-Political,0.0,0.008288851840854044,0.0,1.0096865453927752,"Because of lockdown everyone in my family losing their mind, can anyone suggest me some websites to download Hindi tv shows or movies to help my family kill some timeI don't really watch much movies but looking at my dad just sitting there looking at corona virus news on tv actually started to get him and my family members, I thought some bollywood or dubbed Hollywood movie could refresh their mind from what's going on."
Non-Political,0.0,1.4332178364822175,0.0,0.975323229906216,Kiki challenge. Indian edition
Coronavirus,0.0,0.02034536360936902,0.0,1.009673528233602,"Stranded by lockdown, 5 migrants walk 800 km from Rajasthan to reach home in Punjab | Amritsar News - Times of India"
AskIndia,0.0,0.006781787869789673,0.0,1.0095730188182426,"Weight Loss Advice 

I am 17 year old boy , 5′7″ (174 cm) and weighting 95 kgs . How do I loose weight If i am very choosy about the food I eat (I hate Green Vegetables). What Should be my ideal weight according to my height and how do I achieve it?"
Non-Political,0.0,1.747440674449139,0.0,0.9943170208626921,"[Showerthought] Netflix should provide a ""Skip Song"" Button for Indian movies.Like the way they provide ""Skip Intro"", even ""Skip Song"" should be provided."
Non-Political,0.0,1.3638928938132564,0.0,0.9917617410030396,This is the DON'T DRINK & DRIVE warning on the menu of Bar and Restaurant in Mangalore.
Coronavirus,0.0,0.022605959565965575,0.0,1.0095786638492987,"Under lockdown in Europe, Indian students go online to protest inequalities back home, keep up with academics - Firstpost"
Politics,0.0,1.4867186074550027,0.0,1.0039054827013987,Netflix got no chill
Coronavirus,0.0,0.007535319855321859,0.0,1.0095826097730807,'Cases will be around for 6 to 9 months'
Politics,0.0,1.2109259007502227,0.0,0.9563480248041873,"'Triple Talaq Unconstitutional', Says Supreme Court In Majority Verdict"
AskIndia,0.0,0.005274723898725301,0.0,1.0095171772855402,Need carrier advice.I'm a second year CS student. What should I learn to get a good job after graduation? What do companies expect from fresher's? Is it enough to know what colleges  teach you or will I have to learn a lot more?  I'm interested in ML/AI.
Politics,0.0,1.4332178364822175,3.4317718940936865,1.0032442468932246,Cartoon of the day: Jharkhand Election Results by @CartoonistAlok
Coronavirus,0.0,0.00904238382638623,0.0,1.0096695600452172,COVID-19 Relief for Survivors of Gender-Based Violence & Child Sexual Abuse
Coronavirus,0.0,0.015070639710643718,0.0,1.0096198247389185,Agra first 100-bed multispecialty Covid-19 facility becomes functional | Agra News - Times of India
Non-Political,0.0,1.3751958735962393,0.0,0.972642205930171,Someone in my office had his last day today!
Politics,0.0,1.390266513306883,0.0,0.9690937402988669,Can I get justice please
Coronavirus,0.0,0.32251168980777556,0.0,1.009494549451452,"Mumbai: Food is coming, BMC helpline kept assuring poor. For 48 hours, nothing reached"
Science/Technology,0.0,0.1921506563107074,3.4317718940936865,1.0095606759584743,"""Zoom not a safe platform,"" says government, warns people on video conference service for meetings"
AskIndia,0.0,0.008288851840854044,0.0,1.0096893570940675,"Important:Hi all, I am an Indian, currently stuck in Dubai.  I want to move back to India to my home town immediately after the lock down is lifted.

 Can I realistically book a flight ticket on the first week after 3rd May to either kolkata or Bangalore?
Spice Jet, is showing tickets are available for booking. 

Also, do I have to stay in 14 day quarantine because of my travel through airport?

Please redirect me to relevant sites.
I am alone here, and stressed out a lot. Thanks."
Coronavirus,0.0,0.38354778063588263,0.0,1.009511233908804,"He came here, before me"
Coronavirus,0.0,0.017331235667240274,0.0,1.0096732833229691,COVID-19: Air India B-787 aircraft leaves for China's Guangzhou from Delhi to pick up medical supplies | News - Times of India Videos
Coronavirus,0.0,0.03315540736341618,0.0,1.00950323709954,Agra first in country to adopt pool testing for COVID-19.
Politics,0.0,1.605023129183556,6.863543788187373,1.0028522442064212,"""Rioteers can be indentified by their Dress"""
Non-Political,0.0,1.8190262130746966,0.0,1.0055897814700474,Flipkart now uniting long lost brothers.
Coronavirus,0.0,0.008288851840854044,0.0,1.009681346926042,"Total Tests For COVID-19 Per 1,000 People In South Asia"
AskIndia,0.0,0.013563575739579345,0.0,1.0096690829465815,"[Help] Advice needed.I am a resident of North India and I joined a tech firm which rhymes with “eee. seee. esss.” in Mumbai. When Maharashtra went into lockdown on 20th of march, I flew back to my hometown within hours (dick move, I know). I am single child and both my parents are senior citizens living by themselves. I don’t earn that much, and living in mumbai means I only save like a couple of thousands each month after all the bills paid. 

Just Now the company called, and wants me back, and since no transport service is active, I am pardoned till the time comes. 

Please advise me what should I do. I know it’s a no brainier to refuse and stay at home. But I want to point out that it took me 6 months to get a job and losing one would be a bummer. 

Thanks.

Edit: Redacted some words."
Politics,0.0,1.5944736813861053,0.0,1.007030345176805,SanitaryPanels strikes again.
Non-Political,0.0,3.2258704300632877,0.0,1.0056986337502145,Stolen
Politics,0.0,0.0007535319855321859,0.0,1.009661071506293,DD waves Rs 500 to show ‘PM cares’
Non-Political,0.0,0.30216632619840655,0.0,1.0095627650143668,"A polite request to all Indians hereI don't know if it is the same situation in other countries, but in India, I have seen A LOT of organisations which have very toxic environments.

There are offices where senior managers harass / shout at juniors, there are colleges where senior students rag juniors, there are school teachers who make fun of students who are not so good at studies and so on.

In many of the cases, I have seen that seniors harass juniors only because they were themselves harassed in the past by their own seniors. Many managers pick up the habit of shouting at juniors because they were shouted at too, when they were juniors. Do you see the problem here? - This cycle is never going to stop. One able person will harass another - this person will then harass someone else  and this will keep continuing.

So here is my request - BREAK THE CHAIN. Try to be polite to people (especially juniors around you). Try not to vent out your frustration on your maid. When you shout on her, she may not reply you, but she is definitely going to shout at someone else that day to vent out her frustration (perhaps she might shout at her kids). This will slowly start to have impact and I am hopeful people will get healthier work environments. Remember that Indians are very low in the happiness index list, and with small efforts from our side, we can improve."
Coronavirus,0.0,0.031648343392351806,0.0,1.0096227903840373,‘India exporting medicines and Pak…’: Army Chief’s stinging takedown of Islamabad - india news
Coronavirus,0.0,1.7353841626806241,0.0,1.0083985374734663,Bengal man who was out to buy milk dies after being beaten up by police
Politics,0.0,1.507817503049904,0.0,1.0033464802249874,From Jakob's wall.
Scheduled,0.0,1.276483183491523,0.0,1.0037245204611878,Woke up to a magnificent view of Pune city behind the new Hyperloop tracks. #SuperPower2020
Politics,0.0,1.3518363820447414,0.0,0.9958266105639134,Mumbai Meri Jaan by Manjul
Coronavirus,0.0,0.02185242758043339,0.0,1.009517373850178,"Watch | ""Have to fill our stomach"": Migrant workers scour through piles of rotten bananas in Delhi's Nigambodh Ghat amid #CoronavirusLockdown. Report by NDTV's Saurabh Unmute"
Coronavirus,0.0,0.007535319855321859,0.0,1.0095753699603187,"14 new COVID-19 cases reported from Kashmir; over 58,000 under surveillance in J-K"
Politics,0.0,0.009795915811918417,0.0,1.0095691314185598,Islamic State propaganda in India
Photography,0.0,1.730862970767431,0.0,1.0068702747677802,Painted near cyber tower
Business/Finance,0.0,0.008288851840854044,0.0,1.0095612611994673,"Closing Bell: Nifty ends near 9K, Sensex gains 222 pts; Nifty Bank up nearly 2%"
Coronavirus,0.0,0.02712715147915869,0.0,1.009605558217452,This is how HD Kumaraswamy’s hosting a Covid-proof wedding for his son Nikhil today
Politics,0.0,7.444896017057997,10.29531568228106,1.0092795643533408,The wealth inequality in India is truly horrifying
Coronavirus,0.0,0.05726843090044612,0.0,1.009493095254811,"In half of Mumbai’s deaths, delays in testing and admission to hospitals; experts to audit | An analysis of the first 50 COVID-19 deaths in Mumbai that account for 62.9 per cent deaths (112) in the state, shows that just over half of them died within hours or a day of hospitalisation."
Non-Political,0.0,0.006028255884257487,0.0,1.0095761689415004,Shiv Tandav Stotram | Anurag Ft. Swarit Nigam
Business/Finance,0.0,0.02938774743575525,0.0,1.0096282770183465,"Lockdown will test the resilience of even HDFC Bank, Kotak Mahindra and ICICI Bank"
Politics,0.0,0.018838299638304648,0.0,1.0095894042937827,"Bollywood Nazis: A Tale of Two SistersYesterday, Twitter permanently suspended the account of Rangoli Chandel, Kangana Ranaut's sister and manager, for a tweet that was too hateful even for Twitter, the single largest enabler of hate speech after Facebook and Whatsapp.

Following is the text of the tweet, verbatim:

""A Jamati died of Corona when police and doctors went to check their families they were attacked and killed, make these mullas + secular media stand in a line and shoot them dead... F**k history. They may call us Nazis who cares, life is more important than fake image."" [1]

Rangoli Chandel was followed on Twitter by over 100 thousand people. The tweet remained for everyone to see for almost a whole day. It was retweeted 1497 times and liked by over 5600 people.

Last year, in the wake of the Pulwama attack, Kangana Ranaut had said this of Shabana Azmi and Pakistan:

""The film industry is full of such anti-nationals who boost enemies' morals in many ways, but right now is the time to focus on decisive actions. Pakistan's ban is not the focus, Pakistan's destruction is."" [2]

Earlier this year, the Indian government awarded Kangana Padma Shri, the country's 4th highest civilian honor. 

Following this latest incident, if not a Padma award, it is entirely plausible that Rangoli could at least snag a BJP ticket in an upcoming election. 

Jai Hind."
Non-Political,0.0,1.540219378427788,0.0,0.95003066825919,TIL: An Indian will spend one-fifth of this life's earning on a wedding ceremony
Coronavirus,0.0,0.03315540736341618,0.0,1.009571170856194,"Covid-19: Chhattisgarh to provide free ration even to those without a card for one month, says CM"
Politics,0.0,1.7421659505504137,0.0,0.9943350462852757,"Jawaharlal Nehru Meeting Albert Einstein At Princeton, USA, 1949"
Photography,0.0,1.1935946650829825,0.0,1.000454027125995,"Marina Beach, Tamil Nadu. [OC], Oneplus 5, 2048*1536."
Coronavirus,0.0,0.015824171696175903,0.0,1.0095592802859326,6.50 lakh medical kits to fight coronavirus dispatched from China: Indian envoy | India News - Times of India
